,Course Description,Subject Domain
748,Laboratory and/or field research supervised by faculty members in the School of Integrative Biology. A written report is required. 1 to 5 undergraduate hours. No graduate credit. May be repeated. Credit is not given for more than a combined maximum of 10 hours of IB 390 or IB 490 towards graduation for IB majors. Prerequisite: Consent of instructor.,Biology
749,"Biologists are increasingly using mathematical and computer-based models to complement fieldwork and experimental data. These models provide a context in which to understand and answer existing questions, and also lead us to new questions and new insights. Students will encode biological mechanisms into mathematical models, develop the skills to find solutions to these models and relate them to biological data, and analyze and discuss relevant primary literature. Examples will be drawn largely from ecology and evolutionary biology. 4 undergraduate hours. 4 graduate hours. Prerequisite: MATH 220 or MATH 221; Introductory courses in Ecology and Evolution.",Biology
750,Experimental and temporary courses. Additional fees may apply. See Class Schedule. 1 to 5 undergraduate hours. 1 to 4 graduate hours. Approved for letter and S/U grading. May be repeated as topics vary. Prerequisite: Consent of instructor.,Biology
751,"This taxon-neutral course prepares students to organize, integrate and analyze complex, multi-scale data that describe biological systems. It provides training, collecting, and processing ""omic""-scale data (genomics, transcriptomics and proteomics) into network models, and analyzing these models using current in silico tools to determine biological significance and function of the resulting network interactions. Students will be introduced to Gene Ontology and open source tools for data integration and visualization, including Cytoscape, Multiple Experiment Viewer and STRING. 2 graduate hours. No professional credit. Prerequisite: Graduate student status or consent of instructor. At least one upper level undergraduate course in molecular biology or its equivalent.",Biology
752,Same as CPSC 567. See CPSC 567.,Biology
753,"Discussions, reviews, and appraisals of special topics in the field of entomology. 0 to 1 graduate hours. No professional credit. Approved for Letter and S/U grading. May be repeated if topics vary.",Biology
754,"Examines new human infectious diseases, such as Asian flu, West Nile virus, AIDS, and Lyme disease, that are a major threat to human health. Explores the historic links among human health, disease pathogens, and ecology, as well as the origin of each new disease and how it is regulated by specific environmental conditions. Also explores how global change and biodiversity loss will increase the possibility of future ecological epidemic and the steps needed to reduce their effects on human health. In this course, students also produce teaching materials for their classrooms.",Biology
755,"The interaction of plants and environment at the level of the whole organism, extending to the cell and the community; emphasis on heat and mass transfer, plant and soil potentials, and effects of light on growth. Same as CPSC 538. Offered in alternate years. Prerequisite: IB 420; consent of instructor.",Biology
756,"Speaker seminar series featuring discussion, review and critical analysis of general concepts and specific problems in ecology and evolution. Approved for both letter and S/U grading. May be repeated.",Biology
757,Individual topics in research conducted under the supervision of faculty members in the School of Integrative Biology. Designed for graduate students who would like to become more familiar with specialized fields of study prior to committing themselves to a specific area for their doctorate degree. Approved for S/U grading only. May be repeated to a maximum of 16 hours. Prerequisite: Consent of instructor.,Biology
758,"This course introduces students to the School of Information Sciences (iSchool). Students will explore career and professional development within information sciences, building their leadership and collaborative skills, and building a network within and beyond the iSchool. Through a human centered design project focused on an information science problem, students will gain experience and a better understanding of the process to develop an innovative solution addressing a societal need. Prerequisite: Restricted to Majors Only; First Semester Freshman, Intercollegiate and Off-Campus Transfer Students Only.",Computer Science
759,"This course provides an introduction to the field of information science and the major. It offers both historical and contemporary context for understanding the role of information in society. Focus is placed upon critical analysis of information problems as well as understanding the creation, use, and distribution of information in business, policy, education, government, health, and other sectors.",Computer Science
760,Same as CS 107 and STAT 107. See STAT 107.,Computer Science
761,"Individual study in a subject related to information sciences not covered in normal course offerings. Approved for Letter and S/U grading. May be repeated in separate terms to a maximum of 6 hours. Prerequisite: Consent of instructor. Submission of ""Request to Enroll in IS Independent Study"".",Computer Science
762,Undergraduate Open Seminar. Additional fees may apply. See Class Schedule. May be repeated.,Computer Science
763,"Explores the way in which information technologies have and are transforming society and how these affect a range of social, political and economic issues from the individual to societal levels. Same as INFO 202 and MACS 202.",Computer Science
764,"A survey of mathematical topics for students in information sciences. Provides an introduction to sets, relations, graphs, grammars, probability, and propositional and predicate logic. These topics relate to applications in information modeling, representation and expression. Prerequisite: MATH 112 or Required ALEKS Score.",Computer Science
765,"This course provides an introduction to different approaches to research in the information sciences, including social science methods, data and text mining, digital humanities, historical approaches, and others. Topics include methods for evaluating research, developing research questions, selecting research methods, conducting research ethically, and communicating findings clearly and effectively through words, graphics, and other visualizations.",Computer Science
766,Covers common data processing methods and computing concepts used in the information sciences. Evaluates strengths and weaknesses of the techniques in the context of our discipline. No prior programming background is assumed. Course will use the Python programming language. Prerequisite: IS 203.,Computer Science
767,"Introduction to database technology concepts and architecture. Explore data types and reading/writing database layout descriptions. Discussion of database ethics and privacy concerns. Comparison of different database systems a user might encounter including RDBMS, XML/RDF/JSON, NOSQL, and Graph database systems. Labs involving common database tools and exercises in SQL. Prerequisite: IS 205, or CS 101, or CS 105, or CS 125, or ECE 120, or permission of instructor.",Computer Science
768,"This course introduces students to fundamental theories and techniques in Human-Computer Interaction (HCI). This course presents basic tools and methods for creating, designing, prototyping, and evaluating user interfaces to computing applications and web sites. Students will explore course content by conducting individual and group hands-on projects. Assignments involving prototyping can be implemented by self-selected solutions, e.g. Axure, JavaScript. Students from all backgrounds are welcomed.",Computer Science
769,"A professional field experience program designed to provide the student with the opportunity to work in a professional environment under the supervision of an experienced information professional with the guidance of a faculty advisor. This opportunity allows students to integrate the theory and knowledge of course content with the application of principles and practices in a work environment, including these specific objectives Approved for S/U grading only. Prerequisite: IS 101 or IS 202. Restricted to BSIS students only.",Computer Science
770,Designed to provide students an opportunity to apply the skills and concepts learned in Information Sciences classes to a work environment. Students will complete internships of their choosing under supervision and will be expected to complete activities online including a reflective paper and presentation. The goal of this course is to provide an experience that will form a connection between a student’s academic career and career goals for the future. Approved for S/U grading only. May be repeated. Prerequisite: IS 101 or IS 202. Restricted to BSIS students only.,Computer Science
771,"Provides campus credit toward the undergraduate degree for study at accredited foreign institutions or approved overseas programs. Final determination of credit and its application toward the degree is made by the School of Information Sciences (iSchool) office after a review of the student's work abroad. Approved for Letter and S/U grading. May be repeated in separate terms to a maximum of 44 hours. Maximum of 18 hours per regular term. Summer session, 0 to 8 hours. Prerequisite: One academic year (or one semester in the case of transfer students) of full-time residence at UIUC, good academic standing, and prior approval of the School of Information Sciences. Consent of major department, school, and Study Abroad Office.",Computer Science
772,"In this course we will critically examine the ways in which information and communication technologies (ICTs) are shaped by – and help to shape – social relations of race and gender; and we will extend our review to other categories of identity and exclusion as well, such as age, ability, geography and ethnicity. We will also explore the various benefits and burdens of the information society and how these are socially distributed, and conduct case-studies of policies, practices, and programs designed to enhance opportunities and/or mitigate disadvantages through the creative or disruptive use of ICTs. Directed and supervised investigation of selected topics in information studies that may include among others computers and culture; information policy; community information systems; production, retrieval and evaluation of scientific or social science knowledge; computer-mediated communication; and computer-supported cooperative work. Prerequisite: IS 202 Highly recommended. Sophomore standing.",Computer Science
773,"This course explores cultural ideas about computers, including hopes and fears about the effects of computers on our lives. We will analyze images of computers in fiction and movies. The course will also discuss hackers, online subcultures, and other computer-related subcultures, and the integration of computers into various cultural practices. The course will also explore the different uses of digital media. Prerequisite: IS 202 Highly recommended.",Computer Science
774,"Explores use and application of technology to scholarly activity in the humanities, including projects that put classic texts on the web or create multimedia application on humanities topics. Same as INFO 310. Prerequisite: Sophomore standing.",Computer Science
775,"Introduces theories of social networks (how they form, and how they influence  thoughts, feelings, and behaviors), while also providing hands-on experience with some powerful  tools and methods for analyzing networks on various scales, ranging from small groups, to  communities, to populations. It will also explore the use of network analysis to reveal patterns in large-scale data from the  humanities such as periods of literary narrative, or character development across vast narratives  with multiple interweaving plot lines.  Same as SOC 324.",Computer Science
776,"Focuses on project management methodology that will allow you to initiate and manage projects efficiently and effectively. You will learn key project management skills and strategies, and you will have the opportunity to apply this knowledge through assignments.",Computer Science
777,"Advanced individual study in a subject related to Information Sciences not covered in normal course offerings. Approved for Letter and S/U grading. May be repeated in separate terms to a maximum of 6 hours. Prerequisite: Consent of instructor. ""Request to Enroll in IS Independent Study”. Restricted to students with Junior level standing or above.",Computer Science
778,"Directed and supervised investigation of selected topics in information studies that may include among others computers and culture; information policy; community information systems; production, retrieval and evaluation of scientific or social science knowledge; computer-mediated communication; and computer-supported cooperative work. May be repeated. Prerequisite: Sophomore standing.",Computer Science
779,"Venue for presentation and discussion of research and professional activities by faculty, students, staff, and guest speakers. 0 or 1 undergraduate hours. 0 or 1 graduate hours. Approved for Letter and S/U grading. May be repeated in separate semesters.",Computer Science
780,"This course provides a deep hands-on sociotechnical dive into technology including electronics, software, and networks culminating in a holistic understanding of networked information systems. The course also explores the methodological landscape of networked information systems including theoretical assumptions, research methods, and research techniques. Throughout, students will be introduced to, and make active use of, skillsets, frameworks, and standards employed by a wide range of information professionals in selecting, co-designing, appropriating, and innovating-in-use networked information systems. Additional fees may apply. See Class Schedule. 4 undergraduate hours. 4 graduate hours.",Computer Science
781,"This course introduces students to data science approaches that have emerged from recent advances in programming and computing technology. They will learn to collect and use data from a variety of sources, including the web, in a modern statistical inference and visualization paradigm. The course will be based in the programming language R, but will also use HTML, regular expressions, basic unix tools, XML, and SQL. Supervised and unsupervised statistical learning techniques made possible by recent advances in computing power will also be covered. 4 undergraduate hours. 4 graduate hours.",Computer Science
782,"Fundamental principles of the art of storytelling including techniques of adaptation and presentation; content and sources of materials; methods of learning; practice in storytelling; planning the story hour for school and public libraries and other public information settings; and audio, video, and digital media. 3 undergraduate hours. 2 or 4 graduate hours. Prerequisite: For undergraduates, junior or senior standing and consent of instructor.",Computer Science
783,"Evaluation, selection and use of books and other resources for young adults (ages 12-18) in public libraries and school media centers; explores standard selection criteria for print and nonprint materials in all formats and develops the ability to evaluate and promote materials according to their various uses (personal and curricular) and according to young adults' various needs (intellectual, emotional, social and physical). 3 undergraduate hours. 2 or 4 graduate hours. Prerequisite: For undergraduates, junior or senior standing and consent of instructor.",Computer Science
784,"Community engagement refers to the multiple ways that information professionals in libraries and other settings learn about, collaborate with, and provide service and outreach to community members. Provides an introduction to, and overview of, community engagement theory and practice. A significant portion of coursework will take the form of service learning or community-based research via approved projects that match students' interests. 3 undergraduate hours. 4 graduate hours.",Computer Science
785,"Introduces students to a range of rapid prototyping techniques and methods to analyze needs, opportunities and design spaces. Students will work in teams to develop ideas for novel computational devices or applications to meet identified needs. Covers the interlinked entrepreneurial skills of identifying an unmet need, exploiting technological opportunities, exploring a design space to refine an idea, and communicating a design vision through demonstrations with prototypes and proofs of concept. This enables developers to show how their envisaged working interactive technology will be used productively in a particular real-life context. Communicating the vision of computational devices is a challenge because dynamic use in context is hard for people other than the device's developers to imagine. The ability to produce convincing, clear, powerful demonstrations even at the early stages of a project is a highly valuable entrepreneurial skill, and also highly applicable within an organization. Directed and supervised investigation of selected topics in information studies that may include among others the social, political, and historical contexts of information creation and dissemination; computers and culture; information policy; community information systems; production, retrieval and evaluation of knowledge; computer-mediated communication. 3 undergraduate hours. 4 graduate hours. Prerequisite: Undergraduate students: Priority is given to students pursuing a transfer into the BS/IS degree (http://go.ischool.illinois.edu/BSIS).",Computer Science
786,"Librarians fill a key role in the literacy development of young children with opportunities for interaction both in the library and through outreach programs. Key skills center on developing literacy-rich library environments, classroom instructional support, intentional embedding of essentials skills and practices within daily activities and lessons, resources about early literacy strategies to share with families and caregivers. Practitioners will understand the importance of integration of technology to meet the diverse developmental, cultural, social and linguistic needs of children to ensure they are able to create meaning from text. No undergraduate credit. 2 graduate hours.",Computer Science
787,"This interdisciplinary course introduces students to fundamental theories, methods, technologies and applications of social computing. Students learn about this emerging discipline from two perspectives: First, basic principles of collective information production and processing, and methods for studying these principles. Topics include prediction markets, games with a purpose, open source software development, social media, social networks, information visualization, and online games. Second, socio-technical aspects of the design and usage of respective technologies. This includes participation, privacy and security. Students learn how to solve problems in social computing in a systematic and rigorous fashion. At the end of the course, students will be able to design, manage and execute social computing projects for scholarly and commercial use, and to critically assess work in this area. 3 undergraduate hours. 4 graduate hours.",Computer Science
788,"Focuses on the basics of web site design, content development, constructing web pages with standard HTML and CSS. We will also cover usability and accessibility, content management system options, multi-media and interactivity in the context of standard HTML and CSS, procedures and policies for organizations, with a concentration on public, academic and special libraries. Students will investigate, design, and draft a representative site. Students may work with non-profit and library clients in constructing and redesigning their web sites or design and construct their own personal professional pages. In this course we will learn how to design and deploy flexible websites that serve dynamically changing content, focusing in particular on the needs of public-service organizations such as libraries, associations, and other not-for-profit entities. 4 undergraduate hours. 4 graduate hours. Prerequisite: Laptop Required.",Computer Science
789,"Covers common data, document processing, and programming constructs and concepts. Focuses on problem solving and abstraction with a programming language. By the end of the course students will be able to design, develop and test a moderately complex computer program to manage full text, bibliographic records or multimedia. The course prepares students for working with applications in data analytics, data science, digital libraries, text mining and knowledge management. No prior programming background is assumed. 4 undergraduate hours. 2 or 4 graduate hours.",Computer Science
790,"A course in the use and evaluation of Web application frameworks for system architects, designers, and developers. Experience in creating static Web sites using HTML and CSS. 3 undergraduate hours. 4 graduate hours. Prerequisite: Experience in Python programming (IS 430 or equivalent). Experience in creating static Web sites using HTML and CSS. Experience in creating dynamic Web sites using tools like PHP is helpful but not required. Experience in using relational databases is helpful but not required.",Computer Science
791,"Studio-based learning methods, which are common in art and architectural education, are used to help students address a real-world problem or 'case'. Working in teams and mentored by the instructor and experts, students will learn how to 'be a professional' in an environment in which process is as important as project. During the term, students will participate in a cyclical process of design creation, presentation and critique culminating in a final presentation during the final day(s) of class of the finished proposal/design of how to address the case. Assumes experience in community engagement within a social justice framework. 3 undergraduate hours. 4 graduate hours.",Computer Science
792,"Data visualization is crucial to conveying information drawn from models, observations or investigations. This course will provide an overview of historical and modern techniques for visualizing data, drawing on quantitative, statistical, and network-focused datasets. Topics will include construction of communicative visualizations, the modern software ecosystem of visualization, and techniques for aggregation and interpretation of data through visualization. Particular attention will be paid to the Python ecosystem and multi-dimensional quantitative datasets. 3 undergraduate hours. 4 graduate hours.",Computer Science
793,"Evaluation, selection and use of information books and other resources for young people (ages 0-18) in public libraries and school media centers; explores standard selection criteria for factual print and nonprint materials in all formats and develops the ability to evaluate and promote nonfiction books and resources according to their various uses (personal and curricular) and according to young people's various needs (intellectual, emotional, social and physical). 3 undergraduate hours. 2 or 4 graduate hours.",Computer Science
794,"The course provides students with both theoretical and practical training in good database design. By the end of the course students will create a conceptual data model using entity-relationship diagrams, understand the importance of referential integrity and how to enforce data integrity constraints when creating a database. Students will be proficient in writing basic queries in the structured query language (SQL) and have a general understanding of relational database theory including normalization. 4 undergraduate hours. 4 graduate hours. Prerequisite: Junior Standing required.",Computer Science
795,"An introduction to understanding data as a source for storytelling and to telling stories based on data. This process will include understanding and analyzing data sets to find informative aspects, changes, or contrasts that will provide the basic information for developing stories. Course participants will learn storytelling concepts, narrative theories, and performance techniques and develop stories in a collaborative workshop style. Students will work with data visualization toolkits, which will involve variable levels of coding and skill. By using storytelling techniques with data, students can develop, and tell well-evidenced stories, organizations can make better data-driven decisions. 3 undergraduate hours. 4 graduate hours.",Computer Science
796,"With a focus on Russia, Eastern Europe, and Eurasia, students will investigate this fascinating part of the world, how it has been studied and represented by generations of scholars, scientists, writers, artists, government officials, and others, and how the many fruits of their labors are (or are not) accessible to us today. 3 undergraduate hours. 4 graduate hours.",Computer Science
