,Course Description,Subject Domain
184,"- Magma and magmatism; textures and structures of igneous rocks, classification of igneous rocks, including volcanism and plutonism- Basic igneous rocks - Intermediate igneous rocks - Acid igneous rocks- Sedimentary diagenesis, classification of sedimentary rocks; textures and structures of sedimentary rocks.  - Clastic sedimentary rocks: conglomerate and sandstone, siltstone and mudstone- Biochemical sedimentary rocks: limestone and dolostone- Metamorphism; controlling factors of metamorphism; textures and structures of metamorphic rocks; classification of metamorphic rocks- Meta-pelitic rocks- Meta-basic rocks - Meta-carbonate rocks and meta-felsic rocks To give students an understanding of the features in sedimentary, igneous and metamorphic rocks, as well as the ability to identify major rock types and their textures and structures in both hand specimens and under microscope.",Earth Sciences
185,"- Overview of sedimentary geology- Physics of erosion, transportation and sedimentation- Sedimentary structures- Depositional environments (non-marine)- Depositional environments (marine)- Sequence stratigraphy- Basin analysis- Sedimentary environment around Hong Kong- Sedimentary environment on Mars This course discusses the origin, diagenesis, classification and economic importance of sedimentary rocks. Students will learn features and processes of sedimentary geology, paleontology and depositional processes.",Earth Sciences
186,"Class-room based: lecture and laboratory- Introduction: basics on stress, strain, stress-strain relation- Stress- Stereonets- Deformation mechanisms- Strain- Joints- Rheology- Faults and fault systems- Fault plane solutions- Folds- Shear Zones- Fabrics (foliations, lineations)- Contractional and extensional systems- Kink method for cross-section construction- Structurally focused map interpretation- Balanced cross sections- Key Structures in HKFieldwork- Joints - Pokfulam Reservoir plus an associated day of self-survey work- Folds plus - Ma Shi Chau- Shear zone - Sai O; and overturned fold limb Ma Tso Lung Structural Geology is the study of rock deformation. Participants in this course will learn about the geometries, kinematics, and mechanics of rock deformation, and how to answer structural geology questions. The course will involve heavy use and generation of geological maps and cross sections and explore their utility for interpreting structure.",Earth Sciences
187,"1. Explanation of the fundamentals of remote sensing2. Description of key remote sensing platforms, sensers and their purposes. 3. How to obtain data of sites on Earth and other planets.4. How to process, analyse and correct remote sensing data. 5. How to interpret remote sensing data.6. How to use software for remote sensing. You will be an expert in highly employable skills if you work hard. 7. How to integrate remote sensing data with Geographic Information Systems (GIS)8. How to apply remote sensing to modern problems in geoscience, climate science, planetary science, and your science.9. How to relate your work to bigger career goals and how to be a professional scientist.10. How to integrate your new skills into your CV so that you have an advantage in the job market. This course serves as an introduction to remote sensing of the Earth and other planets. In this course, we will focus on remote sensing of the Earth using visible, infrared, and microwave radiation.Familiarity with remote sensing data is an essential skill for the modern day geoscientist and environmental scientist. This course will teach you not only about the fundamentals of remote sensing, but also practical skills such as: 1) how to obtain remote sensing data, 2) how to process, correct and interpret images, 3) how to apply results to scientific problems, 4) how to report on your results, 5) how to use cutting edge software, and 6) how to represent your new skills on your CV.",Earth Sciences
188,"- Gravity and gravity anomalies- Geomagnetism- Thermal Properties of the Earth- Seismology An overview of the geophysical characteristics and processes of the solid earth and a survey of the various geophysical disciplines, including seismology, gravity, geothermometry, geomagnetism, as well as exploration geophysical methods for studying the earth's interior and near subsurface structure.",Earth Sciences
189,"- Magma generation: physiochemical conditions and tectonic settings.- Application of trace elements and isotopes to the study of magma genesis - Basaltic magmatism and mantle characteristics - Granitic magma and crustal characteristics- Magmatism at convergent boundaries- Magmatism and crustal growth- Types of metamorphism - Chemical equilibrium/disequilibrium in metamorphism; metamorphic phase diagrams (ACF, A'KF, AFM, etc)- Metamorphic processes and reactions- Metamorphic petrogenesis and evolution of pelitic rocks- Metamorphic petrogenesis and evolution of mafic rocks- Metamorphism in different tectonic settings; metamorphic pressure-temperature-time (P-T-t) paths and their tectonic implications. To provide a comprehensive coverage of the principles and techniques used in the study of petrogenesis of igneous and metamorphic rocks and their cause-and-effect relationships with tectonic settings and crustal evolution.",Earth Sciences
190,"Hydrologic Cycle And water Budgets, Introduction to Hydrogeology (1 Week) Properties Of Aquifers (2 Weeks)Hydraulic head and flow net(2 Weeks)Basic Equations of Groundwater Flow (1 Week)Groundwater Flow To Wells (1 Week)Analysis Of Aquifer Test(2 Weeks)Well installation & pumping test design(1 Week)Regional Groundwater Flow Systems (HK case study)(1 Week)Groundwater contamination (China case study)(Week 12) This course aims to introduce some basic concepts and theories of groundwater flow with special reference to case studies in HK. It consists of three components: 1) fundamentals of groundwater  physics; 2) well hydraulics and evaluation of groundwater as a resource; and 3) influence of groundwater on geotechnical and environmental engineering",Earth Sciences
191,"Introduction to engineering design and the role of the Engineering Geologist; site investigation concepts and skills (air photo interpretation, soil and rock description, engineering geological plans, reporting); slopes, foundations. Case histories from Hong Kong. To present some of the concepts and skills of importance in the profession of Engineering Geology and illustrate their use by case histories.",Earth Sciences
192,"Stress and strain; properties and classifications of soil and rock; clay minerals; pore pressure and effective stress; strength and failure criteria, initial stresses and their measurement; deformation; consolidation; planes of weakness in rocks; ground treatment methods. To provide a basic knowledge of soil and rock mechanics for those wishing to consider further studies on a career in engineering geology/geotechnics.",Earth Sciences
193,"- Atmospheric Basics- Solar & Infrared Radiation- Thermodynamics- Water Vapor- Atmospheric Stability- Clouds- Precipitation Processes- Satellites & Radar- Weather Reports & Map Analysis- Atmospheric Forces & Winds- General Circulation- Fronts & Air Masses- Thunderstorm Fundamentals- Thunderstorm Hazards- Tropical Cyclones This course will cover the five major components of meteorology: (1) thermodynamics, (2) physical meteorology, (3) observation and analysis, (4) dynamics, and (5) weather systems (cyclones, fronts, thunderstorms). The aim is to provide students with a modern understanding of drivers and behavior of weather by examining the processes that govern atmospheric structure and behavior, weather elements, and weather systems.",Earth Sciences
194,"Geological time, the origin of life, fossils and diversification of life through time, Important events in Earth history such as Snowball Earth, the Cambrian explosion of life, the Permian/Triassic mass extinction, the Cretaceous Tertiary extinction event, the origins of humans To introduce the concept of geological time and basic geological principles.  To provide an understanding of the fossil record and the integration of Earth Systems and plate tectonics.  To gain an appreciation of our place in the Universe, an understanding of the evolution of Earth and life on Earth through time.",Earth Sciences
195,"The student undertakes a self-managed study on a topic in earth sciences under the supervision of a staff member. The topic is preferably one not sufficiently covered in the regular curriculum. The directed study can be a critical review or a synthesis of published work on the subject, or a laboratory or field study that would enhance the student's understanding of the subject. The project may not require an element of originality. To enhance the student's knowledge of a particular topic and the student's self-directed learning and critical thinking skills.",Earth Sciences
196,"1) Origin of elements, the Solar system and the Earth2) Geobiology and biogeochemical cycles: their role in the Earth system3) Terrestrial biogeochemical cycles4) Aquatic biogeochemical cycles5) Marine biogeochemical cycles6) Phosphorous cycle7) Sulfur cycle8) Carbon cycle9) Nitrogen cycle10) Biogeochemical cycles and impacts from human activities This course presents how the basic geochemistries of the Earth system, from atmosphere to the geosphere and to hydrosphere, have been and are being affected by the origin, evolution and existence of life. Human activities in particular, from the rapid consumption of resources to the destruction of the rainforests and the expansion of cities, are leading to rapid changes in the geochemistry of the Earth systems.",Earth Sciences
197,"- Plate tectonics; orogenesis; accretionary and collisional orogensis.- Mantle convection; hot spots and plumes; - Methods of investigation of large scale structures and processes; - Structure and physical properties of the planet; - Sea floor spreading; ocean ridges; transform faults; - Subduction zones; mountain belts and orogenesis; - Formation of continental crust; - Continental rifts and continental margins; - Sedimentary basins; - Mechanism, consequence and implication of plate tectonics.- Hadean Earth: Accretion of the Earth from the solar nebula; differentiation of the Earth; formation of the initial atmosphere and oceans; the earliest felsic crust; Late Heavy Bombardment.- Archean cratons: greenstones and TTG gneisses; origin of komattites; role of mantle plumes in Archean crustal formation and evolution; when did plate tectonics start on Earth?- Paleoproterozoic collision tectonics.- Supercontinents in Earth history: the assembly, outgrowth and breakup of supercontinents Columbia (Nuna), Rodinia and Pangea. To review the concepts and processes that shape the configuration of the Earth, from core to crust.This course is intended to provide students with an understanding of the driving forces of Earth processes and the global outcome of these processes through an examination of direct and indirect observations, the evolution of hypotheses, and critical thinking.",Earth Sciences
198,"We will use case studies to explore how regional investigations integrating field-based and analytical research tools can test models for the evolution of large-scale geological systems. Likely case studies include exploration of various climate-tectonic interactions across mountain belts (Andes, Himalaya), the complex intraplate deformation of East Asia, and the progressive development of metamorphic core complexes via low-angle normal faults (N. America, NE China). Students will advance their abilities to synthesize and communicate geological knowledge by creating new Wikipedia pages complete with original figures on regional geological topics of their interest. This course explores regional geologies as well as the approaches that geologists use to resolve regional geological questions.",Earth Sciences
199,"Introductions to Contemporary Environmental IssuesOverpopulation & Natural Resources Overpopulation & Waste ManagementGlobal Trend in Green TechnologyGlobal Trend in Space Exploration Contemporary Environmental Issues & Solutions This is a capstone course that provides students with an opportunity to synthesize and correlate the knowledge gained in previous courses in Earth System Science for them to gain a more in-depth appreciation and awareness of the Earth System, the interplay between its component parts, and some of the global issues. Students will also get some basic concepts on how to do strategic analysis on global trends of natural resources.",Earth Sciences
200,"Students will visit areas of geological interest and will undertake independent and group mapping and problem solving exercises in each area. The curriculum comprised 3 x 6-day long projects (based on an ~2x5km area of interest),where each week long project is typically scheduled as follows:Day 1-2: Instructor-lead learning. Day 3-5: Technique application/independent field mapping and site visit.Day 6: Field examination.Day 7: Write up/Rest.  For each project area students is required to produce:A detailed geologic map of the area. (15% x 3 = 45%)A cross-section of the area. (5% x 3 = 15%)To accompany these maps, the students must prepare ONE report (15%) - This field report should include the tectonic evolution of region, synthesized from the all three projects and site visits, complete with interpretations of depositional environments, magmatic events and structural data.To assess  field skills:3 one-day field exam, where students, working INDEPENDENTLY of other students and faculty, construct a geologic map and cross sections in a small (~1km x ~1km) area that they have not previously visited. (5% for each one-day field exam)10% will be awarded for professional conduct. The aims of a geological field camp activities are to provide: 1) essential training and experience in geological mapping techniques.2) the opportunity to gain confidence in independently applying these skills to areas of structural and stratigraphic complexity. 3) opportunities to study at first-hand areas of particular geological interest and importance of an overseas locality. The course requires integration of geological knowledge from multiple geological disciplines.",Earth Sciences
201,"(1) Within the university: The student will be supervised by a staff member (Supervisor), working on a project or various tasks as instructed by the Supervisor.(2) Outside the university: The student will work in an external agency related to the major of study. The student will be supervised under a staff member of the external agency (the External Supervisor) and a staff member of the Department/School of the student (the Internal Supervisor). The work to be performed by the student will normally be instructed by the External Supervisor, with prior agreement of the Internal Supervisor. This course aims to offer students the opportunities to gain work experience in the industry related to their major of study. The workplace learning experience would be of great benefits to the students to apply their knowledge gained in the study to the real work environments. Students have to take on at least 160 hours of internship work either within the University or outside the University arranged by the School/Departments.",Earth Sciences
202,"The student undertakes a research project in the form of a senior thesis under the supervision of a staff member. The project could be based on a particular component of a staff member's research or one proposed and designed by the student. The student must involve in the project in a non-trivial manner, and play a major role in the project formulation, data collection and analysis, and presentation. The project should contain an element of originality. To enhance the student's knowledge, ability and interest in advanced studies in the Earth Sciences by providing the student with an opportunity to be engaged in an advanced research project.",Earth Sciences
203,"The teaching and learning will be organized around key issues, and loosely divided into three sections. Part I: The basics: application of science to solve environmental problems; key ecological, chemical, and earth science concepts essential to environmental science, understanding the underlying causes of environmental problems (human population growth and economics). Part II: Using and conserving our resources: how we use and misuse key natural resources; the difficulty in assuring a sustainable supply of energy; waste management and air pollution issues. Part III: Global issues: How do our actions change the face of the planet? Can sustainable development be achieve? Will we be able to limit our contribution to global climate change? To provide students with an inter-disciplinary introduction to Environmental Science highlighting the interconnections between biological, geological, and chemical processes.  To convey the basic science behind environmental interactions and place it within the context of human impacts and dependence on the natural world.  To better understand how humans interact, manage, and sustain the environment within the context of our economies, governments and individual choices.",Earth Sciences
204,"Valuing the environmentBasic concepts of Environmental Economics - Identification of and engagement with relevant stakeholdersResourse management for land, air, water and biomassManagement of wasteEnergy policies and economicsPlanning and regulations for a sustainable future This course follows up issues highlighted in the introductory course and provides in-depth studies about rural and urban environments for students to examine the problems of resource scarcity and pollutant accumulation in the natural environment, which are the problems human society is currently confronted. The course will focus on major environmental problems and explore how Environmental Economics can be applied for resource management and environmental restoration/protection. Students will analyze the nature of key natural resources such as land, air, water and biomass, and explore ways to improve resource management, protect the environment and develop sustainable economies.",Earth Sciences
205,"Overview of Global PollutionPhysical-Chemical Characteristic of Soils, water and the atmospherePhysical, Chemical and Biological Contaminants Contaminants Transport ProcessesEnvironmental ToxicologyWater PollutionAtmospheric PollutionSoil, Land and subsurface PollutionUrban and Household pollutionMonitoring and Risk Assessment StrategyIntroduction to remediation, restoration, treatment and reuseGlobal system and the human dimensions to environmental pollution This multi-disciplinary course will introduce students to the most important physical, chemical and biological contaminants that pollute the environment. The course will provide the basics of contaminant transport, toxicology, pollution monitoring and environmental risk assessment. The course will also explore in details different mechanisms and pathways for water, atmosphere, soil and land pollution. The student will also be invited to reflect on the socio-economic aspect of pollution and remediation.",Earth Sciences
206,"To provide a solid foundation of knowledge about the physical processes dictating the oceans movements and their impacts on the environment and ecosystems. The oceans take up 71% of earth's surface and contain 98% of the water.  By looking at the structure of the atmosphere, thermodynamic principals and properties governing sea water, we will evaluate the critical roles the ocean plays in the environmental system including its influence on (paleo)climate, coastal resources, and nutrient cycling.  Case studies specifically examining changes in sea level rise, El Nino, and (paleo)climate will be used to connect oceanographic principles to environmental problems. To provide students with a thorough introduction to coastal and ocean processes with key questions to highlight the importance of the (paleo)oceanographic processes to environmental and ecological conditions.To convey the basic science behind ocean-atmosphere and ocean-biosphere interactions and place it within the context of human's connectedness and impact to the physical world.",Earth Sciences
207,"The directed study is typically a review of the literature on a specific topic related to environmental sciences, undertaken under the supervision of a staff member. However, the exact format of the project is flexible and alternative formats can be considered with the approval of the supervisor and the Course Coordinator. The topic is flexible, but must be related to the field of environmental science. Students should seek approval from a prospective supervisor prior to selecting this course. After admission to the course is approved by the course coordinator, students will work under the guidance of their supervisor to complete the study and the research report. This is a Capstone Course designed to provide an opportunity for Environmental Science students to integrate the knowledge obtained through their Environmental Science courses. Through this course, students will enhance their knowledge on a particular topic in environmental science and critical thinking skills through self-directed learning. Both the written and oral report emphasize communication skills.",Earth Sciences
208,"In the case of the work being carried out in an external agency, students will be supervised by a staff member of the external agency (the External Supervisor) and a staff member of the University (the Internal Supervisor). If the work is carried out within HKU, there is no need for an additional internal supervisor. The work to be performed by students will normally be instructed by the External Supervisor, with prior agreement of the Internal Supervisor. This course offers students the opportunity to gain work experience related to their major of study. This work experience will allow the students to apply their knowledge gained in their studies to the real environmental issues.",Earth Sciences
209,"Students will undertake a research project in the form of an undergraduate dissertation under the supervision of a staff member. The dissertation will be written in the style of a scientific paper. The research topic is flexible but should be related to the field of Environmental Science. Students should seek approval from a prospective supervisor prior to selecting this course. After admission to the course is approved by the course coordinator, students will work under the guidance of their supervisor to complete the research project. The objective of this course is to provide an opportunity for students to integrate and apply their knowledge and skills obtained from the Environmental Science major. Students will gain experience in designing and carrying out a scientific study, and in communicating the results of their research in a professional manner.",Earth Sciences
210,"The course will cover: Computational science as the third methodology; Basic numerics, floating-point representation, errors and computational complexity; Dense linear algebra, algorithms and libraries; Sparse linear algebra and Low-rank approximation; Simple ordinary differential equations and Partial differential equations on structured grids; Spectral methods - Fast Fourier Transforms (FFTs) and applications; N-body problems and fast multipole methods; Monte Carlo methods. The development of High-Performance Computing (HPC) systems has been largely driven by the requirements of Computational Scientists running large-scale numerical simulations such as global weather forecasting or studying new materials at the atomic scale. This course covers some of the basic numerical algorithms and computational patterns used in HPC and how they are implemented and used in practice, including Artificial Intelligence (AI), Machine Learning (ML), and Deep Learning (DL).",Mathematics
211,"1. Logic2. Linear Equations3. Quadratic Equations4. Graphs and Functions5. Differentiation6. Unconstrained optimization7. Partial differentiation8. Constrained optimization9. Integration10. Geometric series11. Difference equations (optional)12. Differential equations (optional)13. Matrix algebra (optional) This course aims at introducing important topics of mathematics for introductory or intermediate level courses in Business and Economics. Mathematical concepts and methods, as well as some Business and Economics applications, would be emphasized so that students could be furnished with the essential mathematical skills for the senior courses in these disciplines.",Mathematics
212,"- Sets, Venn diagram, set operations.- Permutations, combinations and elementary probabilities.- Mathematical induction.- Exponential and logarithmic functions.- Trigonometric functions, trigonometric formulae.- Limits of algebraic, exponential and logarithmic functions.- Derivatives of algebraic, exponential and logarithmic functions.- Differentiation rules: addition, product, quotient and chain rule.- Maxima and minima.- Indefinite and definite integrals.- Area. - Integration by substitution.- Trapezoidal rule with error estimation. This course aims at students with only HKDSE Mathematics (or equivalent) background and provides them with basic knowledge of mathematics that serves as essential foundation in various disciplines. It is expected to be followed by MATH1013.",Mathematics
