,Course Description,Subject Domain
0,"This is an introductory course in computer programming. Students will acquire basic Python programming skills, including syntax, identifiers, control statements, functions, recursions, strings, lists, dictionaries, tuples and files. Searching and sorting algorithms, such as sequential search, binary search, bubble sort, insertion sort and selection sort, will also be covered. ",Computer Science
1,"This is an introductory course designed for first-year engineering students to learn about computer programming. Students will acquire basic Python programming skills, including syntax, identifiers, control statements, functions, recursions, strings, lists, dictionaries, tuples and files. Searching and sorting algorithms, such as sequential search, binary search, bubble sort, insertion sort and selection sort, will also be covered. ",Computer Science
2,"This course covers intermediate to advanced computer programming topics on various technologies and tools that are useful for software development. Topics include Linux shell commands, shell scripts, C/C++ programming, and separate compilation techniques and version control.  This is a self-learning course; there will be no lecture and students will be provided with self-study materials.  Students are required to complete milestone-based self-assessment tasks during the course.  This course is designed for students who are interested in Computer Science / Computer Engineering.",Computer Science
3,"This course introduces the basic concepts of financial technologies, including money and payment, digital finance and alternative finance. Major technological trends, such as e-payment system, cryptocurrency, blockchain, data mining and artificial intelligence, are introduced. Students are expected to understand recent FinTech developments and its impact in the financial industries.",Computer Science
4,"This course introduces concepts and applications of basic data structures. Commonly used data structures, which include stacks and queues, trees, lists, arrays and graphs, will be discussed. Basic algorithms, both recursive and non-recursive, to manipulate these data structures will also be discussed.Basic object-oriented programming principles, which are abstraction, encapsulation, inheritance and polymorphism, will be introduced. The practical work of the course will use an object-oriented programming language and corresponding data structure library. Students will be required to apply the data structures to solve practical and/or FinTech problems.",Computer Science
5,"Arrays, linked lists, trees and graphs; stacks and queues; symbol tables; priority queues, balanced trees; sorting algorithms; complexity analysis.",Computer Science
6,"To introduce the hardware organization of computers, and detailed operations of computers through assembly language programming.Introduction to computer organization and architecture; data representations; instruction sets; machine and assembly languages; basic logic design and integrated devices; the central processing unit and its control; memory and caches; I/O and storage systems; computer arithmetic.",Computer Science
7,"This course provides students a solid background on discrete mathematics and structures pertinent to computer science. Topics include logic; set theory; mathematical reasoning; counting techniques; discrete probability; trees, graphs, and related algorithms; modeling computation.",Computer Science
8,Introduction to object-oriented programming; abstract data types and classes; inheritance and polymorphism; object-oriented program design; Java language and its program development environment; user interfaces and GUI programming; collection class and iteration protocol; program documentation.,Computer Science
9,"This course introduces basic theories of blockchain and distributed ledger, which includes basic cryptography, public key cryptosystem, distributed computing and consensus protocols. Financial applications of blockchain and distributed ledger will be discussed.",Computer Science
10,"Operating system structures, process and thread, CPU scheduling, process synchronization, deadlocks, memory management, file systems, I/O systems and device driver, mass-storage structure and disk scheduling, case studies.",Computer Science
11,Network structure and architecture; reference models; stop and wait protocol; sliding window protocols; virtual circuits and datagrams; IP addressing and routing; flow control; congestion control; local area networks; transport protocols and application layer; and examples of network protocols.,Computer Science
12,"The course introduces various algorithm design techniques, including divide and conquer, greedy, and dynamic programming, and studies selected topics on graph algorithms. These techniques can be used to design better algorithms in various areas of computer science. The course also gives an overview of NP-complete problems.",Computer Science
13,"The course studies principles of algorithm design and the analysis of sophisticated algorithms (regarding proof of correctness and time complexity). Topics include divide-and-conquer, dynamic programming, greedy algorithms, graph algorithms, network flow, geometric algorithms, and NP-completeness.  The course puts emphasis on mathematical rigor; it expects students to figure out the mathematics and logic that make algorithms work.  Students can form pairs to discuss the assignments and are required to write rigorous proofs of correctness and analysis independently.",Computer Science
14,"This course studies the principles, design, administration, and implementation of database management systems.  Topics include: entity-relationship model, relational model, relational algebra, database design and normalization, database query languages, indexing schemes, integrity and concurrency control.",Computer Science
15,"This course introduces the fundamental principles, methodologies and practices of modern software engineering. It covers the software process, and development activities including requirements engineering, software design, testing, deployment and evolution. The course emphasizes the use of contemporary tools, frameworks and techniques. It features a complete agile development project in which students work in teams to engineer and cloud-deploy a software service to satisfy their clients’ needs.",Computer Science
16,"The course consists of two components: internship and professionalism. Internship requires students to spend a minimum of four weeks employed, full-time, as IT interns or trainees. During this period, they are engaged in work of direct relevance to their programme of study. The Internship provides students with practical, real-world experience and represents a valuable complement to their academic training. Professionalism exposes students to social and professional issues in computing. Students need to understand their professional roles when working as computer professionals as well as the responsibility that they will bear. They also need to develop the ability to ask serious questions about the social impact of computing and to evaluate proposed answers to those questions. Topics include social context of computing, risks, safety and security concerns for computer professionals, professional and ethical responsibilities, and continuing professional development.",Computer Science
17,"Student individuals or groups, during the final year of their studies, undertake full end-toend development of a substantial project, taking it from initial concept through to final delivery. Topics range from applied software development to assignments on basic research. In case of a team project, significant contribution is required from each member and students are assessed individually, such that each student is given a separate project title. Strict standards of quality will be enforced throughout the project development.",Computer Science
18,"Students during the final year of their studies undertake a substantial project, taking it from initial concept through to final delivery, and integrating their knowledge and skills on computing.",Computer Science
19,"Student individuals or groups, during the final year of their studies, undertake full end-to-end development of a substantial project, taking it from initial concept through to final delivery. The project will be the application of technology to finance discipline.",Computer Science
20,"The course introduces basic concepts and methodology of data science. The goal of this course is to provide students with an overview and practical experience of the entire data analysis process. Topics include: data source and data acquisition, data preparation and manipulation, exploratory data analysis, statistical and predictive analysis, data visualization and communication. ",Computer Science
21,Introduction to computer design process; performance and cost analysis; instruction set design; data-path and controller design; pipelining; memory system; I/O design; GPU architecture and programming; introduction to advanced topics.,Computer Science
22,"Lexical analysis; symbol table management; parsing techniques; error detection; error recovery; error diagnostics; run-time memory management; optimization; code generation.",Computer Science
23,"The course teaches the basics of functional programming using the language Haskell. The main goal is introduce students to fundamental programming concepts such as recursion, abstraction, lambda expressions and higher-order functions and data types. The course will also study the mathematical reasoning involved in the design of functional programs and techniques for proving properties about functions so defined. With the adoption of lambda expressions recent versions of Java, C++ or C#, functional programming and related programming techniques are becoming increasingly more relevant even for programmers of languages that are not traditionally viewed as functional. This course is important to introduce students to such techniques.",Computer Science
24,"Syntax and semantics specification; data types; data control and memory management; expressions, precedence and associativity of operators; control structures; comparative study of existing programming languages; advanced topics such as polymorphism, programming paradigms, exception handling and concurrency.",Computer Science
25,This is an introduction course on the subject of artificial intelligence. Topics include: intelligent agents; search techniques for problem solving; knowledge representation; logical inference; reasoning under uncertainty; statistical models and machine learning. ,Computer Science
26,"Overview of graphics hardware, basic drawing algorithms, 2-D transformations, windowing and clipping, interactive input devices, curves and surfaces, 3-D transformations and viewing, hidden-surface and hidden-line removal, shading and colour models, modelling, illumination models, image synthesis, computer animation.",Computer Science
27,"This course introduces algorithms, tools, practices, and applications of machine learning. Topics include core methods such as supervised learning (classification and regression), unsupervised learning (clustering, principal component analysis), Bayesian estimation, neural networks; common practices in data pre-processing, hyper-parameter tuning, and model evaluation; tools/libraries/APIs such as scikit-learn, Theano/Keras, and multi/many-core CPU/GPU programming. ",Computer Science
28,"This course offers an introduction to the interdisciplinary field of quantum information and computation. We will start from the basic rules of quantum theory and become familiar with the counterintuitive notions of quantum superposition and entanglement. In particular, we will see how quantum systems could be used to detect an object without directly interacting with it (Elitzur-Vaidman bomb tester), to increase the amount of bits that can be sent through a transmission line (dense coding), and to increase the chance to win certain games (CHSH game and GHZ game). Once the basics have been covered, we will provide an overview of quantum computation and of major quantum algorithms such as Grover's search algorithm and Shor's factoring algorithm for prime factorization. Finally, we will introduce the upgraded framework of quantum theory, and use it to explore applications to quantum error correction, quantum state discrimination, quantum cryptography, and quantum teleportation. ",Computer Science
29,"This course introduces the principles, mathematical models and applications of computer vision. Topics include: image processing techniques, feature extraction techniques, imaging models and camera calibration techniques, stereo vision, and motion analysis.",Computer Science
30,"Selected network protocols relevant to the World Wide Web (e.g., HTTP, DNS, IP); World Wide Web; technologies for programming the Web (e.g, HTML, XML, style sheets, PHP, JavaScript, Node.js.; other topics of current interest (AJAX, HTML5, web services, cloud computing).",Computer Science
31,"This course introduces the concepts and techniques for computer game design and development. Topics include: game history and genres, game design process, game engine, audio and visual design, 2D and 3D graphics, physics, optimization, camera, network, artificial intelligence and user interface design. Students participate in group projects to gain hands-on experience in using common game engine in the market. ",Computer Science
32,"This course aims at introducing the design and development issues of mobile apps. Students will learn the basic principles, constraints and lifecycle of mobile apps. Then they will learn how to use modern object-oriented languages for the development and different design patterns. Next they will learn various development issues such as graphics, touch events, handling of concurrency, sensors, location services and server connection. Students will also participate in both individual assignments and group project to practice ideation, reading, writing, coding and presentation throughout this course.",Computer Science
33,"An introduction to algorithms and applications of deep learning.  The course helps students get hands-on experience of building deep learning models to solve practical tasks including image recognition, image generation, reinforcement learning, and language translation. Topics include: machine learning theory; optimization in deep learning; convolutional neural networks; recurrent neural networks; generative adversarial networks; reinforcement learning; self-driving vehicle.",Computer Science
34,"The goal of the course is for students to be grounded in basic bioinformatics concepts, algorithms, tools, and databases. Students will be leaving the course with hands-on bioinformatics analysis experience and empowered to conduct independent bioinformatics analyses. We will study: 1) algorithms, especially those for sequence alignment and assembly, which comprise the foundation of the rapid development of bioinformatics and DNA sequencing; 2) the leading bioinformatics tools for comparing and analyzing genomes starting from raw sequencing data; 3) the functions and organization of a few essential bioinformatics databases and learn how they support various types of bioinformatics analysis. ",Computer Science
35,"This course introduces the principles, mechanisms and implementation of cyber security and data protection. Knowledge about the attack and defense are included. Topics include notion and terms of cyber security; network and Internet security, introduction to encryption: classic and modern encryption technologies; authentication methods; access control methods; cyber attacks and defenses (e.g. malware, DDoS).",Computer Science
36,"This course provides an introduction to mathematics and algorithms underneath state-of-the-art robotic systems. The majority of these techniques are heavily based on probabilistic reasoning and optimization – two areas with wide applicability in modern AI. We will also cover some basic knowledge about robotics, namely geometry, kinematics, dynamics, control of a robot, as well as the mathematical tools required to describe the spatial motion of a robot will be presented. In addition, we will cover perception, planning, and learning for a robotic system, with the obstacle avoidance and robotic arm manipulation as typical examples. Note: The focus of the course is on mathematics and algorithms; we will not study mechanical or electrical design of robots.",Computer Science
37,"This course offers a gentle introduction to the field of cryptography. We will start from the basic principles of confidentiality, integrity and authentication.  After that, we will go through some fundamental cryptographic primitives like hash function, symmetric key encryption, public key encryption and digital signatures.  Finally, we will introduce the basics of quantum cryptography including quantum key distribution and random number generation. ",Computer Science
38,"This course introduces the basic concepts and modern software architectures on distributed and parallel computing. Topics include: computer network primitives, distributed transactions and two-phase commits, webservices, parallelism and scalability models, distributed consistency models, distributed fault-tolerance, actor and monads, Facebook photo cache, Amazon key-value stores, Google Map-reduce, Spark, and TensorFlow.",Computer Science
39,"Basics of character animation, keyframe animation, motion capture, inverse kinematics, physically based character animation, Basics of physically-based animation, rigid body dynamics, point-based dynamics, hair animation, cloth simulation, facial animation, crowd simulation, mesh-shape editing, performance capture, skinning, data-driven character control, data-driven cloth animation, data-driven facial animation, data-driven skinning.",Computer Science
40,"Natural language processing (NLP) is the study of human language from a computational perspective. The course will be focusing on machine learning and corpus-based methods and algorithms. We will cover syntactic, semantic and discourse processing models. We will describe the use of these methods and models in applications including syntactic parsing, information extraction, statistical machine translation, dialogue systems, and summarization. This course starts with language models (LMs), which are both front and center in natural language processing (NLP), and then introduces key machine learning (ML) ideas that students should grasp (e.g. feature-based models, log-linear models and then the neural models). We will land on modern generic meaning representation methods (e.g. BERT/GPT-3) and the idea of pretraining / finetuning.",Computer Science
41,"This course allows students to experience a complete AI experimentation and evaluation cycle with a hands-on project.  The course comprises two main components: students first acquire the basic know-how of the state-of-the-art AI technologies, platforms and tools (e.g., TensorFlow, PyTorch, scikit-learn) via example-based modules in a self-paced learning mode.  Students will then identify a creative or practical data-driven application and implement an AI-powered solution for the application as the course project.",Computer Science
42,"Quantum computing can perform hard computational tasks that are far beyond the reach of conventional computers. This course will focus on quantum computing and its realization, offering a tour through the most important concepts and the most recent progresses. The course consists of four major parts: basics of quantum computing, quantum algorithms, quantum machine learning, and quantum error correction. The course starts with an introduction to the essential ingredients of quantum circuits. We will get familiar with quantum computing by going through representative quantum algorithms and visiting more advanced topics in quantum machine learning. We will then discuss how to build a quantum computer: various ways of implementing quantum computations and coping with noises will be discussed. Finally, we will conclude the course with an overview of recent progresses and with a perspective on the future of quantum computing. Tutorials will also be offered on quantum programming, where we will design our own quantum algorithms that address practical problems.",Computer Science
43,"This course introduces basic concepts, technologies, and applications of the Internet of Things (IoT), with a focus on data analytics. The course covers a range of enabling techniques in sensing, computing, analytics, learning for IoT and connects them to exciting applications in smart homes, healthcare, security, etc. The lectures cover the pipeline of data generation, data acquisition, data transportation, data analysis and learning, and data applications, with various topics from the fundamentals (e.g., signal processing, statistical analysis, machine learning) to real-world systems. Billions of things are connected today, and this course helps students to understand how IoT will evolve into AIoT (Artificial Intelligence of Things).",Computer Science
44,"To study some important topics and techniques in big data and data mining. The teaching and learning will focus on the algorithmic and system aspects of these topics. Survey on recent development and progress in selected areas will also be included.The course will study some advanced topics and techniques in big data, with a focus on the algorithmic and system aspects. It will also survey the recent development and progress in selected areas. Topics include: spatial-spatiotemporal data management, textual big data, uncertain data management, indexing, query evaluation and optimization, and data mining.",Computer Science
45,"The course covers banking systems, e-payment security, foreign exchange, Internet banking, wireless payments, stored-value cards, micropayments, peer-to-peer payments, electronic and crypto-currencies such as Bitcoin, large-scale B2B payments and the future of money.",Computer Science
46,"A Biochemical Perspective on the Basic SciencesA. Chemistry for BiochemistryThe elements and bonding (from carbon to Coenzyme A); Resonance and orbital theory (a focus on the electron); Structure and conformation (thinking in 3 dimensions); Isomerism (from mirrors to thalidomide); Water (the universal biochemical solvent) & buffer; Quantitation in chemistry (who was Avogadro anyway?).B. Biology for BiochemistryThe basic building blocks of life (proteins, DNA, lipids, carbohydrate); The Central Dogma of Molecular Biology; Evolution (considering molecular evolution); Origins of life (the chicken-egg paradox of proteins and DNA)C. Physics and Mathematics for BiochemistryThermodynamics from a Biological Perspective; Introduction to molecular recognition and binding (DNA melting); Statistics for biochemistry (applied statistics for what you really need to know); Thinking numbers (exponentials, logs and the limits of life).D. Inspiring BiochemistryThe protein; The gene; Vitamins and disease;  Synthetic biology; The challenges of modern-day genetics Drugs-successes and failures. - Teach students a biochemical perspective on each of the Basic Sciences focusing on concepts fundamental to the learning of Biochemistry. - Promote deep learning of course material through an integrated programme of practical and collaborative tasks.- Inspire students with a view of the great discoveries and future challenges for Biochemistry.- Help students make the transition from school to university by developing their teamwork, independent study skills and confidence to communicate within a Biochemistry learning environment.",Biomedical Sciences
47,"Structure and functions of carbohydrates, lipids, nucleic acids, amino acids and proteins; enzymes and co-enzymes; basic bioenergetics; key metabolic processes in a living cell; signaling across cell membranes; flow of genetic information This course is designed to present an overview of biochemistry of fundamental importance to the life process. We aim to develop appreciation of the basics in biochemistry as a common ground for science and non-science students to progress into their areas of specialization. Students intending to pursue further studies in Biochemistry and Molecular Biology will find this course particularly helpful.",Biomedical Sciences
48,"This course focuses on the central metabolic pathways involved in the provision of energy needed by living organisms. Major metabolic pathways covered in this course include those that are involved in the synthesis and breakdown of glucose, glycogen, triacylglycerol, and amino acids.  The metabolism of purines and pyrimidines will also be considered. Emphasis is on the understanding of the metabolic reactions involved and how they are regulated in relation to environmental cues. Metabolic derangements as a basis of diseases will also be discussed. This course aims to provide foundation concepts of metabolism. It will enable students of this course to see how some of the basic concepts in biochemistry (specifically those learned in BIOC1600 and BIOC2600) could be applied to explain one of the most important and cardinal issues of biological life: the acquisition of metabolic energy. The course will lay the foundation for the more advanced courses offered in the Biochemistry Major and will also serve as a useful complement to courses on nutrition and dietetics.",Biomedical Sciences
