,Course Description,Subject Domain
359,"No formal teaching. Students are expected to devote 120-140 hours working on this project.  Students will work in groups of three to five under the supervision of a teacher.  Students are required to give a presentation on their work two to three weeks before the end of the semester, and submit their final report at the end of the semester.It aims to help the students to establish a good and solid foundation of life-long learning skills, and to enable students to equip with hands-on experience in solving real life problems starting from identification of the key variable(s) of interest, literature search, model formulation, data analysis or simulation, technical report writing and presentation of the results.  Students will need to find an interesting topic of their own, conduct literature search regarding the most recent research related to the problem, make suggestions to improve the current situations or even solve the problem identified in their project. This project-based course aims to provide students with capstone experience to formulate and investigate real life problems in the area of statistics, risk management, finance, climate, social science, medicine and scientific research by integrating and applying the statistical theories and quantitative techniques learnt in their junior university years.",Statistics & Actuarial Science
360,"No formal teaching will be given for this course. Students are expected to devote 120-140 hours working on this project.  Students will work in groups of three to five under the supervision of a teacher and/or an industry supervisor. Students are required to give a presentation on their work two to three weeks before the end of the semester, and submit their final report at the end of the semester. Topics acceptable for projects in this course can be related to any of the traditional actuarial areas of practice such as life insurance, pension, finance, investment, enterprise risk management and general insurance. Students are also encouraged to suggest topics in non-traditional actuarial areas provided they can find a suitable teacher and/or industry supervisor. All topics for this course will be subject to final approval by the Department to ensure relevance to actuarial science.  Students will need to decide on the topic for a practical project, conduct market research regarding industry activities related to the topic, and make suggestion on a solution of the problem identified in their project. This project-based course aims to provide students with capstone experience to formulate and investigate practical problems in actuarial science by integrating and applying actuarial theories and techniques learnt in their university years. It aims to help the students to establish a good and solid foundation of self-learning skills, and to enable students to equip with hands-on experience in solving practical problems including definition of the problem, designing the solution, and presentation of the results.",Statistics & Actuarial Science
361,"Upon completion of the internship, each student is required to submit a written report and to give a presentation on his/her internship experience. The report should emphasize important working/educational experiences encountered by the student during his/her internship. In many situations, this would mean a report of the project(s) that the student has been involved in during his/her internship. This course is offered to students majoring in Decision Analytics/Risk Management/Statistics whotake on a minimum of 160 hours of internship work related to his/her major disciplines. It provides students with first-hand experience in the applications of academic knowledge in a real-life work environment.",Statistics & Actuarial Science
362,"This course will include a written report which should emphasize important working/ educational experiences encountered by the student during his/her internship.  In many situations, this would mean a report of the project(s) that the student has been involved in during his/her internship. This course is offered to actuarial science students who take on a 6-month full time or similar internships.  The objective is for a student to complete this course as a project based on his/her internship.",Statistics & Actuarial Science
363,"These projects, under the supervision of individual staff members, involve the applications of statistics and/or probability in a wide range of problems of practical and/or academic interests. Each year a few projects suitable for Actuarial Science students will be offered to provide students with practical experience in approaching a real problem, in report writing and in oral presentation.",Statistics & Actuarial Science
364,"These projects, under the supervision of individual staff members, involve the applications of statistics and/or probability in a wide range of problems of practical and/or academic interests. Each year a few projects suitable for students majoring in Decision Analytics/ Risk Management/ Statistics will be offered to provide students with practical experience in approaching a real problem, in report writing and in oral presentation.",Statistics & Actuarial Science
365,"1.  General Insurance Markets in Hong Kong, Taiwan and PRC-  Introduction of general insurance markets -  Regulations on general insurance2.  Basic techniques for ratemaking-  How to read and use manual rate pages-  Ratemaking related to exposures-  Ratemaking related to premiums-  Ratemaking related to loss and loss adjustment expenses-  Calculate the underwriting expense provisions-  Pure premium methods -  Loss ratio methods-  Rating differential and relativities-  Considerations when selecting the final rates 3.  Estimating claim liabilities -  Data requirement -  Build and analyze claim development triangles -  Reserving techniques-  Considerations when estimating the claim liabilities -  Estimate recoveries and unpaid claim adjustment expenses-  Appraise and validation of the estimated results 4.  Applications using predictive modeling in General Insurance-  e.g. predictive modeling, Enterprise Risk Management, etc. The purpose of this course is to develop knowledge of the basic techniques for ratemaking and estimating claim liabilities for general insurance. Application of the actuarial techniques to resolve general insurance problems will be emphasized.  The course also provides general knowledge on the general insurance markets in Hong Kong and China. Students will acquire the fundamental concept on general insurance actuarial science together with the supporting calculations.",Statistics & Actuarial Science
366,"Basics of statistical learning, cross-validation, linear model selection and regularization (subset selection, shrinkage methods, dimensional reduction methods), tree-based methods (decision trees, bagging, boosting, random forests), principal component analysis, naive Bayes classification, cluster analysis (K-means clustering, hierarchical clustering), deep learning, survival analysis, multiple testing. To make sense of the vast and complex data sets that have emerged in insurance and finance, it is essential to have a firm understanding of the basic statistical modelling and prediction techniques. This course introduces some useful predictive analytics techniques, such as principal component analysis, naive Bayes classification, decision tree models, and cluster analysis. The R programming language will be used for actual implementation.",Statistics & Actuarial Science
367,"Contents may be selected from:(1) Basic asymptotic methods: modes of convergence; stochastic orders; laws of large numbers; central limit theorems; delta method; Edgeworth expansions; saddlepoint approximations.(2) Parametric and nonparametric likelihood methods: high-order approximations; profile likelihood and its variants; signed likelihood ratio statistics; empirical likelihood.(3) Nonparametric statistical inference: sample quantiles; sign and rank tests; Kolmogorov-Smirnov test; nonparametric regression; density estimation; kernel methods.(4) Computationally-intensive methods: cross-validation; bootstrap; permutation methods.(5) Robust methods: measures of robustness; M-estimator; L-estimator; R-estimator; estimating functions.(6) U-statistics, projection methods.(7) Other topics as determined by the instructor. This course introduces some statistical concepts and methods which potential graduate students will find useful in preparing for work on a research degree in statistics.  Focus is on applications of state-of-the-art statistical techniques and their underlying theory.",Statistics & Actuarial Science
368,"Contents include: sigma-algebra, measurable space, measure and probability, measure space and probability space, measurable functions, random variables, integration theory, characteristic functions, convergence of random variables,  Hilbert spaces, conditional expectation, martingales. This course provides an introduction to measure theory and probability. The course will focus on some basic concepts in theoretical probability which are important for students to do research in actuarial science, probability and statistics.",Statistics & Actuarial Science
369,"Topics from: (i) Linear regression models; (ii) Generalized linear models; (iii) Model selection and regularization; (iv) Kernel and local polynomial regression; selection of smoothing parameters; (v) Generalized additive models; (vi) Hidden Markov models and Bayesian networks. This course introduces modern methods for constructing and evaluating statistical models and their implementation using popular computing software, such as R or Python.  It will cover both the underlying principles of each modelling approach and the model estimation procedures.",Statistics & Actuarial Science
370,"Principles of biology relevant to agriculture, food, energy, and the environment, including microbiology, biochemistry, genetics, plant and animal systems, and ecosystems. Case studies of engineering applications where these biological principles have been taken into account or leveraged for the purpose of design.",Biology
371,"This course develops a comprehensive understanding and appreciation of water and its impact in a global context. The course emphasizes cultural practices associated with water and its use, especially for regions in non-western cultures. Students will develop critical knowledge of: 1) water availability, water quality, and global challenges; 2) historical perspectives of water use; 3) past, present, and future environmental sustainability in relation to water, food, and energy; and 4) conduct analysis of cultural practices and their sustainability based on water in a global context. Students attend 3-4 field trips related to the course.",Biology
372,May be repeated to a maximum of 12 hours.,Biology
373,"Principles of environmental control for biological structures: psychrometrics; mass and heat transfer through buildings; ventilation requirements. Prerequisite: One of MATH 220, MATH 221, MATH 234.",Biology
374,"Principles of bioprocess engineering applied to food and agricultural products: material balances; fluid flow; heat and mass transfers; drying; evaporation; fermentation; distillation; process simulation. Prerequisite: One of MATH 220, MATH 221, MATH 234.",Biology
375,"Individual research, special problems, thesis, development or design work under the supervision of a member of the faculty. May be repeated to a maximum of 8 hours. Prerequisite: Consent of instructor.",Biology
376,"Principles of instrumentation systems, including sensing, signal conditioning, computerized data acquisition, test design, data analysis and synthesis. Additional fees may apply. See Class Schedule. 4 undergraduate hours. 4 graduate hours. Credit is not given for both ABE 425 and ME 360. Prerequisite: ECE 205.",Biology
377,"A project-based experience designed to engage students in development of resilient food, energy, and water supply chains designs for disaster-prone regions. Students will investigate background factors that provide context for specific disaster-prone regions and viable design solutions. Students will quantify expected engineering reliability to potential solutions. Students will work with local communities, aid organizations, and peer institutions when identifying resilient designs, eventually seeking pathways to implement solutions with partner communities. 3 undergraduate hours. 4 graduate hours. May be repeated one time by undergraduate students if the term project differs from previous term, up to total credit of 6 hr for undergraduate students.",Biology
378,"Provides the theoretical basis for understanding and quantifying the physical, hydrological, geotechnical, and thermal properties of soil in relation to environmental processes. Topics include general soil properties as a porous media, particle size, soil structure and aggregation, water retention and potential, flow in saturated soil, flow in an unsaturated soil, soil temperature and heat flow, soil mechanics, infiltration, and soil-plant-water relations. 3 undergraduate hours. 3 graduate hours. Prerequisite: TAM 335 or NRES 201 or consent of instructor.",Biology
379,"Hydrology, hydraulics, design, construction and cost estimating of structures for the conservation and quality control of soil and water resources; relationship of topography, soils, crops, climate, and cultural practices in conservation and quality control of soil and water for agriculture. 3 undergraduate hours. 3 or 4 graduate hours. Prerequisite: Credit or concurrent registration in TAM 335.",Biology
380,"Industry-submitted and sponsored design projects which utilize principles of design, engineering analysis and functional operation of engineering systems. Design teams develop concepts, evaluate alternatives, model and analyze solutions, and build and test a final product. Emphases on communication skills, technical writing, and interaction with industry representatives. 4 undergraduate hours. 4 graduate hours. Prerequisite: One of ABE 361, CHBE 421, TAM 335; or credit or concurrent registration in ME 370.",Biology
381,"Individual research, special problems, thesis, development or design work under the supervision of a member of the faculty. 1 to 4 undergraduate hours. No graduate credit. May be repeated to a maximum of 8 hours. Prerequisite: Consent of instructor.",Biology
382,Subject offerings of new and developing areas of knowledge in agricultural and biological engineering intended to augment the existing curriculum. See Class Schedule or departmental course information for topics and prerequisites. 1 to 4 undergraduate hours. 1 to 4 graduate hours. May be repeated in the same or separate terms if topics vary to a maximum of 16 hours.,Biology
383,"The objective of this course is to cover theory and techniques essential for building cyber-physical systems capable of autonomous decision making in the real-world. This course will lay a foundation for theory and techniques in autonomous planning, machine learning, and adaptive sequential decision making. Topics covered include Planning under uncertainty, Bayesian Nonparametric machine learning, Deep learning and Neural Networks, Markov Decision Processes, and Reinforcement Learning. A key emphasis of the course is placed on transition of fundamental aspects of autonomous decision making to application on robotics systems. 4 graduate hours. No professional credit. Prerequisite: MATH 225; MATH 416, or equivalent; STAT 400, Math 461 or equivalent. An introductory course in machine learning (e.g. CS 446), control (e.g. SE 422), robotics (e.g. ABE 424, ECE 470), OR Artificial Intelligence (CS 440) is required. An introductory software programming course is recommended. Restricted to graduate students in Engineering.",Biology
384,Presentations of thesis research by graduate students; other presentations on teaching or current research issues related to agricultural and biological engineering. Approved for S/U grading only. May be repeated up to a maximum of 6 times.,Biology
385,Individual investigations or studies of any phases of agricultural engineering selected by the student and approved by the advisor and the faculty member who will supervise the study. May be repeated to a maximum of 16 hours. Prerequisite: Consent of instructor.,Biology
386,Subject offerings of new and developing areas of knowledge in agricultural and biological engineering intended to augment the existing curriculum. See Class Schedule or departmental course information for topics and prerequisites. May be repeated in the same or separate terms if topics vary to a maximum of 8 hours.,Biology
387,Approved for S/U grading only. May be repeated.,Biology
388,Study of compound interest and annuities; applications to problems in finance. Prerequisite: MATH 231 or equivalent.,Statistics & Actuarial Science
389,Guided research on introductory actuarial topics. Approved for Letter and S/U grading. May be repeated in separate terms. Prerequisite: Instructor approval required.,Statistics & Actuarial Science
390,Methods and techniques of solving problems in actuarial mathematics for advanced students intending to enter the actuarial profession. Approved for S/U grading only. May be repeated in the same or separate terms to a maximum of 4 hours. Prerequisite: Consent of instructor.,Statistics & Actuarial Science
391,Same as STAT 408. See STAT 408.,Statistics & Actuarial Science
392,"An introduction to stochastic processes and their applications to finance and insurance. Topics include conditional probability, conditional expectation, Markov chains, Poisson processes, reliability theory, Brownian motion and elementary introductions to insurance risk theory and option pricing theory. 3 or 4 undergraduate hours. 3 or 4 graduate hours. Prerequisite: ASRM 401 (formerly MATH 408) or MATH 461.",Statistics & Actuarial Science
393,"Theoretical foundation in financial models and their applications to insurance and other financial risks. Topics include derivative markets, no arbitrage pricing of financial derivatives, interest rate models, dynamic hedging and other risk management techniques. 3 undergraduate hours. 4 graduate hours. Prerequisite: Credit or concurrent registration in ASRM 402 or STAT 410.",Statistics & Actuarial Science
394,Same as STAT 420. See STAT 420.,Statistics & Actuarial Science
395,Same as STAT 432. See STAT 432.,Statistics & Actuarial Science
396,Same as STAT 431. See STAT 431.,Statistics & Actuarial Science
397,"Foundation in the actuarial modeling process; construction, selection and validation of empirical models and parametric models. Also covers survival, severity, frequency and aggregate loss models; statistical methods to estimate model parameters. 3 undergraduate hours. No graduate credit. Credit is not given for ASRM 461 (formerly MATH 478) and ASRM 561 (formerly MATH 568). Prerequisite: ASRM 401 (formerly MATH 408), MATH 461 or MATH 463; credit or concurrent registration in ASRM 402 (formerly MATH 409) or MATH 464.",Statistics & Actuarial Science
398,"Continuation of ASRM 471. Introduction to tabular or parametric survival models with single or multiple-life states; life insurance and annuity premium calculations; reserving and profit measures; introductions to universal life insurances, participating insurances, pension plans and retirement benefits. 3 undergraduate hours. No graduate credit. Credit is not given for ASRM 472 (formerly MATH 472) and ASRM 575 (formerly MATH 565). Prerequisite: ASRM 471 (formerly MATH 471).",Statistics & Actuarial Science
399,Guided research on actuarial topics. 1 to 4 undergraduate hours. 1 to 4 graduate hours. Approved for Letter and S/U grading. May be repeated in separate terms. Prerequisite: ASRM 390 or consent of instructor.,Statistics & Actuarial Science
400,Covers special topics in actuarial science. 1 to 4 undergraduate hours. 1 to 4 graduate hours. Approved for Letter and S/U grading. May be repeated. Prerequisite: Consent of instructor.,Statistics & Actuarial Science
401,Same as CSE 542 and STAT 542. See STAT 542.,Statistics & Actuarial Science
402,"Focuses on financial and insurance applications of statistical learning techniques to build predictive models, with integrated case studies and training on computational software packages and effective communication of statistical results. Topics include the model building process, data preparation, model selection, refinement and validation. Same as STAT 541. 4 graduate hours. No professional credit. Approved for Letter and S/U grading. Prerequisite: ASRM 401 or STAT 410.",Statistics & Actuarial Science
403,"Introduction to the actuarial modeling process: construction, selection and validation of empirical and parametric models. Survival, severity, frequency and aggregate loss models; statistical methods to estimate model parameters. 4 graduate hours. No professional credit. Credit is not given for ASRM 461 (formerly MATH 478) and ASRM 561 (formerly MATH 568). Prerequisite: ASRM 401 (formerly MATH 408), MATH 461 or MATH 463.",Statistics & Actuarial Science
404,"Tabular and parametric survival models with single or multiple-life states; life insurance and annuity premium calculations; reserving, and profit measures; introduction to universal life insurances, participating insurances, pension plans and retirement benefits. 4 graduate hours. No professional credit. Credit is not given for ASRM 472 (formerly MATH 472) and ASRM 575 (formerly MATH 565). Prerequisite: ASRM 471 (formerly MATH 471).",Statistics & Actuarial Science
405,"Full-time or part-time practice of graduate-level actuarial science, risk management or advanced analytics in an off-campus government, industrial, or research laboratory environment. Summary report required. 0 graduate hours. No professional credit. Approved for S/U grading only. May be repeated in separate terms. Prerequisite: After obtaining an internship, Actuarial Science or Risk Management graduate students must request entry from the Director of the Actuarial Science Program. Departmental approval required.",Statistics & Actuarial Science
406,Students present seminars and discussions on advanced topics in areas of actuarial and financial mathematics and advanced analytics. 0 to 4 graduate hours. No professional credit. Approved for Letter and S/U grading. May be repeated in separate terms or up to 8 hours in the same term if topics vary. Prerequisite: Consent of instructor.,Statistics & Actuarial Science
407,Approved for both letter and S/U grading. May be repeated.,Biology
408,Laboratory work and/or reading in fields selected in consultation with an appropriate faculty member. May be repeated in separate terms to a maximum of 10 hours. Prerequisite: Consent of instructor.,Biology
409,Same as MCB 406. See MCB 406.,Biology
410,"Physical properties of biological macromolecules, with the emphasis on spectroscopic methods, including UV, visible and FTTR spectroscopies, magnetic resonance techniques as well as X-ray diffraction methods. Same as CHEM 472 and MCB 446. 3 undergraduate hours. 3 graduate hours. Prerequisite: It is strongly recommended to take CHEM 440 (section B) prior to this course. MCB 354 or MCB 450 or equivalent background in biochemistry is also recommended.",Biology
411,"Introduction to modern methods of experimentation with biochemical experimentation. Lectures and labs on the theory and practices underlying various methods and instrumentation. Includes protein purification and quantitative analyses, immunoassays, enzymology, peptide sequencing, lipid analysis, carbohydrate analysis, and bioinformatics. 4 undergraduate hours. 4 graduate hours. Prerequisite: CHEM 232 or CHEM 236, or equivalent; credit in MCB 251 or equivalent, and MCB 354 or MCB 450 or equivalent, or consent of instructor.",Biology
412,"Limited in general to seniors in biochemistry. BIOC 492 is recommended for all those who plan to do research and graduate study, and it is a prerequisite for graduation with distinction in biochemistry. Each student who desires to do thesis research must receive written permission from a member of the biochemistry faculty. Accordingly, prospective students are encouraged to contact the biochemistry staff in the term prior to registration in this course. Students must present a thesis to receive credit in this course. 1 to 6 undergraduate hours. No graduate credit. May be repeated; enrollment is limited to three semesters. Prerequisite: MCB 354 and BIOC 455, or consent of instructor.",Biology
413,"Designed for students in biochemistry who wish to undertake individual studies of a non-Ph.D. thesis nature under the direction of a faculty member of the department. Approved for S/U grading only. May be repeated. (Summer Session, 1 to 8 hours). Prerequisite: Consent of head of department.",Biology
414,"Students, faculty, and invited speakers present seminars and discussions on current research topics. Required of all Biochemistry Ph.D. students. Approved for S/U grading only. May be repeated to a maximum of 12 hours. Prerequisite: Graduate standing in Biochemistry.",Biology
415,"Tailored to follow the organ system courses in allowing medical students to learn the structure and function of the circulatory, respiratory, renal, digestive, neuro-musculoskeletal, genitourinary and reproductive systems, as well as to ways to integrate ethical issues into the study and application of anatomy. No graduate credit. 0 professional hours. Approved for S/U grading only. May be repeated in separate semesters. Prerequisite: Restricted to students enrolled in the Carle Illinois College of Medicine curriculum.",Biology
