,Course Title,Course Description,Subject Domain,Course Code
384,Plant Systematics,"Introduces the principles and methods of identifying, naming, and classifying flowering plants; provides an introduction to the natural history of flowering plants (pollination biology, dispersal mechanisms, breeding systems) and the use of phylogeny estimation in producing modern classifications; develops skills in using plant identification keys; and includes a survey of 40 of the most important plant families distributed worldwide.",Biology,IB335
385,Ecology and Human Health,"Exploration of the emergence of infectious diseases and other human health issues from an ecological perspective, including vector-borne diseases, diseases spread from wildlife in terrestrial and aquatic ecosystems, and the role of pathogens and parasites in community and population ecology, food webs, and ecosystem functioning. Attention will be placed on how current and future global change and biodiversity loss will contribute to the increasing prevalence of human emerging diseases. Same as ANTH 361.",Biology,IB361
386,Undergraduate Research Experience,Laboratory and/or field research and/or reading supervised by faculty members in the School of Integrative Biology. Approved for S/U grading only. May be repeated to a maximum of 10 hours. Credit is not given for more than a combined maximum of 10 hours of IB 390 or IB 490 towards graduation for IB majors. Prerequisite: Consent of instructor.,Biology,IB390
387,Population Genetics,Same as ANSC 446. See ANSC 446.,Biology,IB416
388,Insect Physiology,The principal physiological and biochemical functions of insects. Lecture and laboratory. Offered in alternate years. 4 undergraduate hours. 4 graduate hours. Prerequisite: IB 202 and IB 401; or consent of instructor.,Biology,IB427
389,Genes and Behavior,"Concepts, methods, and problems in the analysis of the relationship between genes and behavior, the complex neurobiological processes that mediate action on behavior, in appropriate ecological and evolutionary contexts. Same as ANTH 432, NEUR 432, and PSYC 432. 3 undergraduate hours. 3 graduate hours. Prerequisite: IB 150 and IB 204; or consent of instructor.",Biology,IB432
390,Biogeography,"Spatial and temporal patterns of biological diversity and the factors that govern the distribution and abundance of taxa. This course addresses two of its subfields: historical biogeography - the origin, dispersal, and extinction of taxa and biotas; and ecological biogeography - the role physical and biotic environments have played in determining taxonomic distributions. Also explores the ecological, evolutionary, climatological, and paleontological foundations for the distribution of species and biological communities. Includes a review of many of the field's classical papers, the current synthesis of biogeographic theory, and the relevance of biogeography to modern conservation goals. Offered in alternate years. Same as ANTH 436, ESE 439, GEOG 436, and NRES 441. 3 undergraduate hours. 3 graduate hours. Prerequisite: IB 150 or other introductory biology course, or consent of instructor.",Biology,IB439
391,Plants and Global Change,Same as CPSC 431 and NRES 431. See CPSC 431.,Biology,IB440
392,Evolution of Infectious Disease,Same as MCB 435. See MCB 435.,Biology,IB442
393,Conservation Biology,"Synthesis of conservation biology with an emphasis on the preservation of biological diversity and its evolutionary potential. Laboratory includes an introduction to the use of modern molecular techniques in conservation biology, computer simulation modeling, and field conservation problem solving. Same as CPSC 436 and ENVS 420. 4 undergraduate hours. 4 graduate hours. Offered in alternate years. Prerequisite: IB 203 or consent of instructor.",Biology,IB451
394,Ornithology,"Structure, function, ecology, behavior, and evolution of the birds of the world; laboratory devoted to anatomy and identification; and field studies devoted to identification and behavior of birds. Independent research project and two optional weekend field trips. Same as NRES 461. 4 undergraduate hours. 4 graduate hours. Prerequisite: IB 203; or consent of instructor.",Biology,IB461
395,Applied GIS to Environ Studies,Same as GEOG 476. See GEOG 476.,Biology,IB476
396,Vector-borne Diseases,"Study of the major groups of arthropods and associated pathogens that affect the health and well-being of humans and other animals. Training will include ecology, evolutionary biology, and epidemiology of vector-borne diseases; taxonomy and identification of vector arthropods; practical skills in molecular and mathematical biology, spatial analysis and field research. Lecture will make use of technology-enhanced classroom for group-based active learning exercises to address critical challenges in vector-borne disease control. 4 undergraduate hours. 4 graduate hours. Offered in alternate years. Prerequisite: IB 361 or IB 401 or consent of instructor.",Biology,IB481
397,Paleoclimatology,Same as GEOL 484. See GEOL 484.,Biology,IB484
398,Independent Study,Laboratory and/or field research supervised by faculty members in the School of Integrative Biology. A written report is required. 1 to 5 undergraduate hours. No graduate credit. May be repeated. Credit is not given for more than a combined maximum of 10 hours of IB 390 or IB 490 towards graduation for IB majors. Prerequisite: Consent of instructor.,Biology,IB490
399,Theoretical Biology + Models,"Biologists are increasingly using mathematical and computer-based models to complement fieldwork and experimental data. These models provide a context in which to understand and answer existing questions, and also lead us to new questions and new insights. Students will encode biological mechanisms into mathematical models, develop the skills to find solutions to these models and relate them to biological data, and analyze and discuss relevant primary literature. Examples will be drawn largely from ecology and evolutionary biology. 4 undergraduate hours. 4 graduate hours. Prerequisite: MATH 220 or MATH 221; Introductory courses in Ecology and Evolution.",Biology,IB494
400,Special Courses,Experimental and temporary courses. Additional fees may apply. See Class Schedule. 1 to 5 undergraduate hours. 1 to 4 graduate hours. Approved for letter and S/U grading. May be repeated as topics vary. Prerequisite: Consent of instructor.,Biology,IB496
401,Biological Networks,"This taxon-neutral course prepares students to organize, integrate and analyze complex, multi-scale data that describe biological systems. It provides training, collecting, and processing ""omic""-scale data (genomics, transcriptomics and proteomics) into network models, and analyzing these models using current in silico tools to determine biological significance and function of the resulting network interactions. Students will be introduced to Gene Ontology and open source tools for data integration and visualization, including Cytoscape, Multiple Experiment Viewer and STRING. 2 graduate hours. No professional credit. Prerequisite: Graduate student status or consent of instructor. At least one upper level undergraduate course in molecular biology or its equivalent.",Biology,IB502
402,Bioinformatics &amp; Systems Biol,Same as CPSC 567. See CPSC 567.,Biology,IB505
403,Disc in Plant Physiology,Approved for letter and S/U grading. May be repeated.,Biology,IB513
404,Seminar in Entomology,"Discussions, reviews, and appraisals of special topics in the field of entomology. 0 to 1 graduate hours. No professional credit. Approved for Letter and S/U grading. May be repeated if topics vary.",Biology,IB526
405,Emerging Infectious Diseases,"Examines new human infectious diseases, such as Asian flu, West Nile virus, AIDS, and Lyme disease, that are a major threat to human health. Explores the historic links among human health, disease pathogens, and ecology, as well as the origin of each new disease and how it is regulated by specific environmental conditions. Also explores how global change and biodiversity loss will increase the possibility of future ecological epidemic and the steps needed to reduce their effects on human health. In this course, students also produce teaching materials for their classrooms.",Biology,IB531
406,Environmental Plant Physiology,"The interaction of plants and environment at the level of the whole organism, extending to the cell and the community; emphasis on heat and mass transfer, plant and soil potentials, and effects of light on growth. Same as CPSC 538. Offered in alternate years. Prerequisite: IB 420; consent of instructor.",Biology,IB542
407,Topics in Ecology &amp; Evolution,"Speaker seminar series featuring discussion, review and critical analysis of general concepts and specific problems in ecology and evolution. Approved for both letter and S/U grading. May be repeated.",Biology,IB546
408,Individual Topics,Individual topics in research conducted under the supervision of faculty members in the School of Integrative Biology. Designed for graduate students who would like to become more familiar with specialized fields of study prior to committing themselves to a specific area for their doctorate degree. Approved for S/U grading only. May be repeated to a maximum of 16 hours. Prerequisite: Consent of instructor.,Biology,IB590
409,Exploring the iSchool with a Human-Centered Lens,"This course introduces students to the School of Information Sciences (iSchool). Students will explore career and professional development within information sciences, building their leadership and collaborative skills, and building a network within and beyond the iSchool. Through a human centered design project focused on an information science problem, students will gain experience and a better understanding of the process to develop an innovative solution addressing a societal need. Prerequisite: Restricted to Majors Only; First Semester Freshman, Intercollegiate and Off-Campus Transfer Students Only.",Computer Science,IS100
410,Introduction to Information Sciences,"This course provides an introduction to the field of information science and the major. It offers both historical and contemporary context for understanding the role of information in society. Focus is placed upon critical analysis of information problems as well as understanding the creation, use, and distribution of information in business, policy, education, government, health, and other sectors.",Computer Science,IS101
411,Data Science Discovery,Same as CS 107 and STAT 107. See STAT 107.,Computer Science,IS107
412,Independent Study,"Individual study in a subject related to information sciences not covered in normal course offerings. Approved for Letter and S/U grading. May be repeated in separate terms to a maximum of 6 hours. Prerequisite: Consent of instructor. Submission of ""Request to Enroll in IS Independent Study"".",Computer Science,IS189
413,Undergraduate Open Seminar,Undergraduate Open Seminar. Additional fees may apply. See Class Schedule. May be repeated.,Computer Science,IS199
414,Social Aspects Info Tech,"Explores the way in which information technologies have and are transforming society and how these affect a range of social, political and economic issues from the individual to societal levels. Same as INFO 202 and MACS 202.",Computer Science,IS202
415,Analytical Foundations for Information Problems,"A survey of mathematical topics for students in information sciences. Provides an introduction to sets, relations, graphs, grammars, probability, and propositional and predicate logic. These topics relate to applications in information modeling, representation and expression. Prerequisite: MATH 112 or Required ALEKS Score.",Computer Science,IS203
416,Research Design for Information Sciences,"This course provides an introduction to different approaches to research in the information sciences, including social science methods, data and text mining, digital humanities, historical approaches, and others. Topics include methods for evaluating research, developing research questions, selecting research methods, conducting research ethically, and communicating findings clearly and effectively through words, graphics, and other visualizations.",Computer Science,IS204
417,Programming for Information Problems,Covers common data processing methods and computing concepts used in the information sciences. Evaluates strengths and weaknesses of the techniques in the context of our discipline. No prior programming background is assumed. Course will use the Python programming language. Prerequisite: IS 203.,Computer Science,IS205
418,Introduction to Database Concepts &amp; Applications,"Introduction to database technology concepts and architecture. Explore data types and reading/writing database layout descriptions. Discussion of database ethics and privacy concerns. Comparison of different database systems a user might encounter including RDBMS, XML/RDF/JSON, NOSQL, and Graph database systems. Labs involving common database tools and exercises in SQL. Prerequisite: IS 205, or CS 101, or CS 105, or CS 125, or ECE 120, or permission of instructor.",Computer Science,IS206
419,Introduction to HCI,"This course introduces students to fundamental theories and techniques in Human-Computer Interaction (HCI). This course presents basic tools and methods for creating, designing, prototyping, and evaluating user interfaces to computing applications and web sites. Students will explore course content by conducting individual and group hands-on projects. Assignments involving prototyping can be implemented by self-selected solutions, e.g. Axure, JavaScript. Students from all backgrounds are welcomed.",Computer Science,IS226
420,BSIS Practicum,"A professional field experience program designed to provide the student with the opportunity to work in a professional environment under the supervision of an experienced information professional with the guidance of a faculty advisor. This opportunity allows students to integrate the theory and knowledge of course content with the application of principles and practices in a work environment, including these specific objectives Approved for S/U grading only. Prerequisite: IS 101 or IS 202. Restricted to BSIS students only.",Computer Science,IS249
421,BSIS Internship,Designed to provide students an opportunity to apply the skills and concepts learned in Information Sciences classes to a work environment. Students will complete internships of their choosing under supervision and will be expected to complete activities online including a reflective paper and presentation. The goal of this course is to provide an experience that will form a connection between a student’s academic career and career goals for the future. Approved for S/U grading only. May be repeated. Prerequisite: IS 101 or IS 202. Restricted to BSIS students only.,Computer Science,IS269
422,Information Sciences Study Abroad,"Provides campus credit toward the undergraduate degree for study at accredited foreign institutions or approved overseas programs. Final determination of credit and its application toward the degree is made by the School of Information Sciences (iSchool) office after a review of the student's work abroad. Approved for Letter and S/U grading. May be repeated in separate terms to a maximum of 44 hours. Maximum of 18 hours per regular term. Summer session, 0 to 8 hours. Prerequisite: One academic year (or one semester in the case of transfer students) of full-time residence at UIUC, good academic standing, and prior approval of the School of Information Sciences. Consent of major department, school, and Study Abroad Office.",Computer Science,IS299
423,"Race, Gender, and Information Technology","In this course we will critically examine the ways in which information and communication technologies (ICTs) are shaped by – and help to shape – social relations of race and gender; and we will extend our review to other categories of identity and exclusion as well, such as age, ability, geography and ethnicity. We will also explore the various benefits and burdens of the information society and how these are socially distributed, and conduct case-studies of policies, practices, and programs designed to enhance opportunities and/or mitigate disadvantages through the creative or disruptive use of ICTs. Directed and supervised investigation of selected topics in information studies that may include among others computers and culture; information policy; community information systems; production, retrieval and evaluation of scientific or social science knowledge; computer-mediated communication; and computer-supported cooperative work. Prerequisite: IS 202 Highly recommended. Sophomore standing.",Computer Science,IS308
424,Computers and Culture,"This course explores cultural ideas about computers, including hopes and fears about the effects of computers on our lives. We will analyze images of computers in fiction and movies. The course will also discuss hackers, online subcultures, and other computer-related subcultures, and the integration of computers into various cultural practices. The course will also explore the different uses of digital media. Prerequisite: IS 202 Highly recommended.",Computer Science,IS309
425,Computing in the Humanities,"Explores use and application of technology to scholarly activity in the humanities, including projects that put classic texts on the web or create multimedia application on humanities topics. Same as INFO 310. Prerequisite: Sophomore standing.",Computer Science,IS310
426,Social Network Analysis,"Introduces theories of social networks (how they form, and how they influence  thoughts, feelings, and behaviors), while also providing hands-on experience with some powerful  tools and methods for analyzing networks on various scales, ranging from small groups, to  communities, to populations. It will also explore the use of network analysis to reveal patterns in large-scale data from the  humanities such as periods of literary narrative, or character development across vast narratives  with multiple interweaving plot lines.  Same as SOC 324.",Computer Science,IS324
427,Project Management,"Focuses on project management methodology that will allow you to initiate and manage projects efficiently and effectively. You will learn key project management skills and strategies, and you will have the opportunity to apply this knowledge through assignments.",Computer Science,IS340
428,Independent Study,"Advanced individual study in a subject related to Information Sciences not covered in normal course offerings. Approved for Letter and S/U grading. May be repeated in separate terms to a maximum of 6 hours. Prerequisite: Consent of instructor. ""Request to Enroll in IS Independent Study”. Restricted to students with Junior level standing or above.",Computer Science,IS389
429,Special Topics in Information Studies,"Directed and supervised investigation of selected topics in information studies that may include among others computers and culture; information policy; community information systems; production, retrieval and evaluation of scientific or social science knowledge; computer-mediated communication; and computer-supported cooperative work. May be repeated. Prerequisite: Sophomore standing.",Computer Science,IS390
430,Colloquium,"Venue for presentation and discussion of research and professional activities by faculty, students, staff, and guest speakers. 0 or 1 undergraduate hours. 0 or 1 graduate hours. Approved for Letter and S/U grading. May be repeated in separate semesters.",Computer Science,IS400
431,Introduction to Network Information Systems,"This course provides a deep hands-on sociotechnical dive into technology including electronics, software, and networks culminating in a holistic understanding of networked information systems. The course also explores the methodological landscape of networked information systems including theoretical assumptions, research methods, and research techniques. Throughout, students will be introduced to, and make active use of, skillsets, frameworks, and standards employed by a wide range of information professionals in selecting, co-designing, appropriating, and innovating-in-use networked information systems. Additional fees may apply. See Class Schedule. 4 undergraduate hours. 4 graduate hours.",Computer Science,IS401
432,Introduction to Data Science,"This course introduces students to data science approaches that have emerged from recent advances in programming and computing technology. They will learn to collect and use data from a variety of sources, including the web, in a modern statistical inference and visualization paradigm. The course will be based in the programming language R, but will also use HTML, regular expressions, basic unix tools, XML, and SQL. Supervised and unsupervised statistical learning techniques made possible by recent advances in computing power will also be covered. 4 undergraduate hours. 4 graduate hours.",Computer Science,IS407
433,Storytelling,"Fundamental principles of the art of storytelling including techniques of adaptation and presentation; content and sources of materials; methods of learning; practice in storytelling; planning the story hour for school and public libraries and other public information settings; and audio, video, and digital media. 3 undergraduate hours. 2 or 4 graduate hours. Prerequisite: For undergraduates, junior or senior standing and consent of instructor.",Computer Science,IS410
434,Teen Materials,"Evaluation, selection and use of books and other resources for young adults (ages 12-18) in public libraries and school media centers; explores standard selection criteria for print and nonprint materials in all formats and develops the ability to evaluate and promote materials according to their various uses (personal and curricular) and according to young adults' various needs (intellectual, emotional, social and physical). 3 undergraduate hours. 2 or 4 graduate hours. Prerequisite: For undergraduates, junior or senior standing and consent of instructor.",Computer Science,IS413
435,Community Engagement,"Community engagement refers to the multiple ways that information professionals in libraries and other settings learn about, collaborate with, and provide service and outreach to community members. Provides an introduction to, and overview of, community engagement theory and practice. A significant portion of coursework will take the form of service learning or community-based research via approved projects that match students' interests. 3 undergraduate hours. 4 graduate hours.",Computer Science,IS418
436,Entrepreneurial Information Technology Design,"Introduces students to a range of rapid prototyping techniques and methods to analyze needs, opportunities and design spaces. Students will work in teams to develop ideas for novel computational devices or applications to meet identified needs. Covers the interlinked entrepreneurial skills of identifying an unmet need, exploiting technological opportunities, exploring a design space to refine an idea, and communicating a design vision through demonstrations with prototypes and proofs of concept. This enables developers to show how their envisaged working interactive technology will be used productively in a particular real-life context. Communicating the vision of computational devices is a challenge because dynamic use in context is hard for people other than the device's developers to imagine. The ability to produce convincing, clear, powerful demonstrations even at the early stages of a project is a highly valuable entrepreneurial skill, and also highly applicable within an organization. Directed and supervised investigation of selected topics in information studies that may include among others the social, political, and historical contexts of information creation and dissemination; computers and culture; information policy; community information systems; production, retrieval and evaluation of knowledge; computer-mediated communication. 3 undergraduate hours. 4 graduate hours. Prerequisite: Undergraduate students: Priority is given to students pursuing a transfer into the BS/IS degree (http://go.ischool.illinois.edu/BSIS).",Computer Science,IS419
437,Early Literacy,"Librarians fill a key role in the literacy development of young children with opportunities for interaction both in the library and through outreach programs. Key skills center on developing literacy-rich library environments, classroom instructional support, intentional embedding of essentials skills and practices within daily activities and lessons, resources about early literacy strategies to share with families and caregivers. Practitioners will understand the importance of integration of technology to meet the diverse developmental, cultural, social and linguistic needs of children to ensure they are able to create meaning from text. No undergraduate credit. 2 graduate hours.",Computer Science,IS423
